{
  "schema_version": "1.0.0",
  "kind": "kdna-current-index",
  "updated": "2026-10-09T06:20:00.000Z",
  "repository": "https://github.com/aikdna/kdna-assets",
  "listing_policy": "AIKDNA reference display only. Listing does not imply endorsement, correctness, quality, expertise, protocol approval, or official truth.",
  "assets": [],
  "clusters": []
}
