{
  "schema_version": "1.0.0",
  "kind": "kdna-current-index",
  "updated": "2026-07-13T12:00:00+08:00",
  "repository": "https://github.com/aikdna/kdna-assets",
  "listing_policy": "Fixture listing only; it does not imply endorsement, correctness, quality, expertise, approval, or truth.",
  "assets": [],
  "clusters": []
}
